{
  "packId": "fitness.design-system.tokens",
  "packVersion": "v1",
  "status": "frozen",
  "ownerRepoId": "fawxzzy-fitness",
  "tokenGroups": {
    "spacing": {
      "0": "0rem",
      "0.5": "0.125rem",
      "1": "0.25rem",
      "1.5": "0.375rem",
      "2": "0.5rem",
      "2.5": "0.625rem",
      "3": "0.75rem",
      "3.5": "0.875rem",
      "4": "1rem",
      "5": "1.25rem",
      "6": "1.5rem",
      "8": "2rem",
      "10": "2.5rem",
      "12": "3rem"
    },
    "typography": {
      "eyebrow": "text-[11px] font-semibold uppercase tracking-[0.16em] leading-none",
      "title": "text-[clamp(2rem,6vw,2.25rem)] font-semibold leading-[1.02] tracking-[-0.04em]",
      "subtitle": "text-sm leading-snug",
      "accentSubtitle": "text-sm font-medium leading-snug",
      "body": "text-sm leading-normal",
      "sectionLabel": "text-[11px] font-semibold uppercase tracking-[0.16em] leading-none",
      "badge": "text-[11px] font-semibold uppercase tracking-[0.14em] leading-none"
    },
    "colors": {
      "background": {
        "app": "rgb(var(--bg))",
        "panel": "rgb(var(--bg-panel))",
        "card": "rgb(var(--bg-card))",
        "shell": "rgb(var(--bg-shell))"
      },
      "surface": {
        "1": "rgb(var(--surface-1-rgb))",
        "2": "rgb(var(--surface-2-rgb))",
        "3": "rgb(var(--surface-3-rgb))"
      },
      "text": {
        "primary": "rgb(var(--text-primary))",
        "secondary": "rgb(var(--text-secondary))",
        "muted": "rgb(var(--text-muted))",
        "onAccent": "rgb(var(--text-on-accent))"
      },
      "accent": {
        "base": "rgb(var(--accent))",
        "strong": "rgb(var(--accent-strong))"
      },
      "status": {
        "success": "rgb(var(--success-rgb))",
        "warning": "rgb(var(--warning-rgb))",
        "danger": "rgb(var(--danger-rgb))"
      },
      "border": {
        "soft": "rgb(var(--border) / 0.12)",
        "strong": "rgb(var(--border-strong) / 0.18)",
        "focus": "rgb(var(--accent) / 0.3)"
      }
    },
    "radii": {
      "sm": "1rem",
      "md": "1.25rem",
      "lg": "1.5rem",
      "xl": "1.875rem",
      "pill": "999px"
    },
    "shadows": {
      "glassBase": "0 12px 30px rgba(0, 0, 0, 0.24)",
      "glassRaised": "0 18px 44px rgba(0, 0, 0, 0.3)",
      "glassOverlay": "0 18px 44px rgba(0, 0, 0, 0.3)",
      "actionChromeShell": "0 18px 44px rgba(0, 0, 0, 0.3)"
    },
    "borders": {
      "hairline": "1px",
      "soft": "rgb(var(--border-strong) / 0.14)",
      "strong": "rgb(var(--border-strong) / 0.18)",
      "focus": "rgb(var(--accent) / 0.3)"
    }
  }
}
